{
  "$schema": "https://json-schema.org/draft/2020-12/schema",
  "$id": "schemas/LevelConfig.schema.json",
  "title": "LevelConfig",
  "type": "object",
  "additionalProperties": false,
  "required": [
    "levelId",
    "enemyArchetype",
    "variantId",
    "hp",
    "weakPointCount",
    "rotateSpeed",
    "speedMode",
    "weakPointMove",
    "shieldEnabled",
    "regenEnabled",
    "reflectEnabled",
    "limitNeedlesEnabled",
    "multiTargetEnabled"
  ],
  "properties": {
    "levelId": { "type": "integer" },

    "enemyArchetype": {
      "type": "string",
      "enum": [
        "Standard",
        "VariableSpin",
        "OrbitalShield",
        "EnergyShield",
        "Regenerator",
        "RearCore",
        "Reflector",
        "Decoy",
        "Fusion",
        "FinalBoss"
      ]
    },
    "variantId": { "type": "string" },

    "hp": { "type": "integer" },
    "weakPointCount": { "type": "integer" },

    "rotateSpeed": { "type": "number" },

    "speedMode": { "type": "string", "enum": ["fixed", "variable"] },
    "speedMin": { "type": "number" },
    "speedMax": { "type": "number" },

    "weakPointMove": { "type": "boolean" },

    "shieldEnabled": { "type": "boolean" },
    "shieldType": {
      "type": "string",
      "enum": ["orbital", "energy", "breakable"]
    },
    "shieldCount": { "type": "integer" },
    "shieldSpeed": { "type": "number" },

    "regenEnabled": { "type": "boolean" },
    "regenBase": { "type": "number" },
    "regenDelay": { "type": "number" },

    "reflectEnabled": { "type": "boolean" },
    "reflectObjectType": { "type": "string", "enum": ["fixed", "move", "rotate"] },
    "reflectObjectCount": { "type": "integer" },
    "reflectMaxBounces": { "type": "integer" },

    "limitNeedlesEnabled": { "type": "boolean" },
    "limitNeedles": { "type": "integer" },

    "multiTargetEnabled": { "type": "boolean" },
    "targetCount": { "type": "integer" },

    "bossPhases": {
      "type": "array",
      "items": {
        "type": "object",
        "additionalProperties": false,
        "required": ["hpPct"],
        "properties": {
          "hpPct": { "type": "number" },
          "speedMul": { "type": "number" },
          "regenMul": { "type": "number" },
          "addShield": { "type": "boolean", "default": false },
          "weakPointMove": { "type": "boolean" }
        }
      }
    }
  },
  "allOf": [
    {
      "if": { "properties": { "speedMode": { "const": "variable" } } },
      "then": { "required": ["speedMin", "speedMax"] }
    },
    {
      "if": { "properties": { "shieldEnabled": { "const": true } } },
      "then": { "required": ["shieldType", "shieldCount", "shieldSpeed"] }
    },
    {
      "if": { "properties": { "regenEnabled": { "const": true } } },
      "then": { "required": ["regenBase", "regenDelay"] }
    },
    {
      "if": { "properties": { "reflectEnabled": { "const": true } } },
      "then": { "required": ["reflectObjectType", "reflectObjectCount", "reflectMaxBounces"] }
    },
    {
      "if": { "properties": { "limitNeedlesEnabled": { "const": true } } },
      "then": { "required": ["limitNeedles"] }
    },
    {
      "if": { "properties": { "multiTargetEnabled": { "const": true } } },
      "then": { "required": ["targetCount"] }
    }
  ]
}
