[
  {
    "levelId": 15,
    "enemyArchetype": "Regenerator",
    "variantId": "R3",
    "hp": 26,
    "weakPointCount": 4,
    "rotateSpeed": 1.6,
    "speedMode": "variable",
    "speedMin": 1.2,
    "speedMax": 2.0,
    "weakPointMove": true,
    "shieldEnabled": true,
    "shieldType": "orbital",
    "shieldCount": 2,
    "shieldSpeed": 1.2,
    "regenEnabled": true,
    "regenBase": 0.8,
    "regenDelay": 1.5,
    "reflectEnabled": false,
    "limitNeedlesEnabled": false,
    "multiTargetEnabled": false,
    "bossPhases": [
      { "hpPct": 0.7, "addShield": false, "speedMul": 1.0 },
      { "hpPct": 0.4, "addShield": true, "speedMul": 1.1 },
      { "hpPct": 0.2, "addShield": true, "speedMul": 1.2, "regenMul": 1.2 }
    ]
  }
]
